{
  "review_id": "sm-risk-001",
  "report_id": "sm-brief-001",
  "created_at": "2026-03-20T14:35:00Z",
  "overall_status": "caution",
  "flags": [
    {
      "symbol": "AAPL",
      "rule": "stale_data",
      "description": "China demand data may be stale; last cited source 6 weeks old"
    },
    {
      "symbol": "MSFT",
      "rule": "single_source_dependency",
      "description": "Copilot metrics rely heavily on company disclosure; limited third-party validation"
    }
  ],
  "summary": "Two minor cautions: AAPL China data freshness, MSFT Copilot single-source. No forbidden language. Output suitable for human review."
}
